{
    "type":"pipeline",
    "version":2,
    "name":"test pipeline",
    "description":"sert à tester le schéma et mla factory pour pipelines",
    "destination":"data/test",
    "active":true,
    "state":"draft",
    "columns":[],
    "elements":[
        {
            "type":"element",
            "class":"CsvExtractor",
            "name":"extractor",
            "args":[],
            "kwargs":{
                "path":"data/tests/titanic_in.csv"
            }
        },
        {
            "type":"element",
            "class":"CsvLoader",
            "args":[],
            "kwargs":{
                "path":"data/tests/titanic_in.csv"
            }
        }
    ]
}