{
    "type":"pipeline",
    "version":2,
    "name":"test pipeline",
    "description":"sert à tester le schéma et mla factory pour pipelines",
    "destination":"data/test",
    "active":true,
    "state":"draft",
    "columns":[],
    "elements":[
        {
            "type":"element",
            "class":"FakeElement",
            "name":"testElement",
            "args":[],
            "kwargs":{}
        },
        {
            "type":"element",
            "class":"FakeElement",
            "args":[],
            "kwargs":{}
        },
        {
            "type":"element",
            "class":"FakeElement",
            "name":"thirdElement",
            "args":[],
            "kwargs":{}
        }
    ]
}